{
  "id": "state_instance.sample_personal",
  "instance_ref": "state_instance.sample_personal",
  "kind": "personal",
  "display_name": "Example Personal State",
  "runtime_root": "/srv/examples/personal-state",
  "primary_entity_ref": "entity.example_person",
  "entity_kind": "person",
  "governance_refs": [
    "governance.example_user.personal_default"
  ],
  "sensitivity_default": "private",
  "federates_with": [
    "state_instance.sampleco",
    "state_instance.researchco",
    "state_instance.portfolio_co",
    "state_instance.plum"
  ],
  "created_at": "2026-05-16T18:00:00Z",
  "updated_at": "2026-05-16T18:00:00Z"
}
